{
  "$schema": "https://github.com/onovich/Game-Primitives/blob/main/research/calibration-tests/continuous-action-pilot/schema/role-submission-0.1.2.schema.json",
  "actor": {
    "identifier": "fixture-r006-v02",
    "model": "synthetic fixture actor",
    "model_version": "protocol-0.1.1",
    "reasoning_effort": "low",
    "role": "blind_reconstructor_predictor",
    "session_id": "rehearsal-006-fixture-v02"
  },
  "artifact_type": "prediction_submission",
  "artifact_version": "0.1.2",
  "audit_checks": [],
  "audit_decision": null,
  "condition_id": "condition-v02",
  "findings": [],
  "first_submission": true,
  "input_artifacts": [
    {
      "artifact_id": "task.predict.neutral",
      "sha256": "53f46034304fd6659550e553a4aedc5af46556818c5c2dd4d20375a7b708cc0b"
    },
    {
      "artifact_id": "envelope.rehearsal-006.stage2",
      "sha256": "a3a951fdb95cf2a6cb1c473b5ef741e8bba8cd653b121b54476a772936449f49"
    },
    {
      "artifact_id": "template.prediction.rehearsal-006",
      "sha256": "1f60b5e5d6e0da72998c45eba6e88597747cf24252b9d0b7b6094f120a32838b"
    },
    {
      "artifact_id": "submission.reconstruct.fixture.v02",
      "sha256": "d657dadc3ff431bf2b3c4de4b0cfee1666ec056db2e2cb124730b5dfe78c8d78"
    }
  ],
  "packaging": {
    "copied_fields": [
      "pollution",
      "prediction_answers"
    ],
    "envelope_path": "research/calibration-tests/continuous-action-pilot/rehearsals/rehearsal-006/fixtures/assembled/prediction-v02.envelope.json",
    "envelope_sha256": "65833160c8ef7bbb0086ca0612fd52ac234724dc948956b7490292854719230c",
    "mode": "deterministic_field_copy",
    "semantic_copy_verified": true,
    "tool_path": "research/calibration-tests/continuous-action-pilot/tools/build-role-submission-v0.1.1.py",
    "tool_sha256": "d43a3248a645eaeac8d495409ac5fbfe95b66a8d0c7260fa4639ed19472890e7"
  },
  "pollution": {
    "familiarity": {
      "exact_result_knowledge": "none",
      "exact_rule_knowledge": "none",
      "exact_variant_knowledge": "none",
      "project_exposure": "none",
      "recognition_status": "none",
      "recognized_family": null,
      "recognized_work": null,
      "related_genre_experience": "unknown"
    },
    "integrity_exposures": [],
    "stage_update_note": null
  },
  "prediction_answers": [
    {
      "assumptions": [],
      "case_id": "CA-R2",
      "compatible_alternatives": [
        {
          "alternative_id": "raw-input-addition",
          "description": "配置变量不影响读取，两种配置都累计为 7。",
          "expectations": [
            {
              "configuration_id": "config.baseline",
              "expectation_kind": "exact",
              "observation_id": "obs.total-at-stop",
              "tolerance_rule_id": "tol.synthetic.exact",
              "value": {
                "serialized_value": "7",
                "unit": "count",
                "value_type": "integer"
              }
            },
            {
              "configuration_id": "config.variant",
              "expectation_kind": "exact",
              "observation_id": "obs.total-at-stop",
              "tolerance_rule_id": "tol.synthetic.exact",
              "value": {
                "serialized_value": "7",
                "unit": "count",
                "value_type": "integer"
              }
            }
          ]
        },
        {
          "alternative_id": "binary-input-gate",
          "description": "配置 0 抑制输入，配置 1 传递输入。",
          "expectations": [
            {
              "configuration_id": "config.baseline",
              "expectation_kind": "exact",
              "observation_id": "obs.total-at-stop",
              "tolerance_rule_id": "tol.synthetic.exact",
              "value": {
                "serialized_value": "0",
                "unit": "count",
                "value_type": "integer"
              }
            },
            {
              "configuration_id": "config.variant",
              "expectation_kind": "exact",
              "observation_id": "obs.total-at-stop",
              "tolerance_rule_id": "tol.synthetic.exact",
              "value": {
                "serialized_value": "7",
                "unit": "count",
                "value_type": "integer"
              }
            }
          ]
        }
      ],
      "confidence_percent": 100,
      "expectations": [
        {
          "configuration_id": "config.baseline",
          "expectation_kind": "status",
          "observation_id": "obs.total-at-stop",
          "tolerance_rule_id": "tol.synthetic.exact",
          "value": {
            "serialized_value": "indeterminate",
            "unit": null,
            "value_type": "status"
          }
        },
        {
          "configuration_id": "config.variant",
          "expectation_kind": "status",
          "observation_id": "obs.total-at-stop",
          "tolerance_rule_id": "tol.synthetic.exact",
          "value": {
            "serialized_value": "indeterminate",
            "unit": null,
            "value_type": "status"
          }
        }
      ],
      "prediction_status": "indeterminate",
      "reasoning": "条件视图没有给出配置变量、输入采样与状态更新之间的关系，存在多个预测不同的相容结构。",
      "supporting_record_ids": [
        "v-q",
        "op.accumulate",
        "obs.total-at-stop",
        "config.baseline",
        "config.variant"
      ]
    }
  ],
  "prior_stage_submission_sha256": "d657dadc3ff431bf2b3c4de4b0cfee1666ec056db2e2cb124730b5dfe78c8d78",
  "raw_payload": {
    "artifact_id": "payload.submission.predict.fixture.v02",
    "path": "research/calibration-tests/continuous-action-pilot/rehearsals/rehearsal-006/fixtures/positive/prediction-indeterminate-two-alternatives.payload.json",
    "schema_path": "research/calibration-tests/continuous-action-pilot/schema/blind-response-interface-0.1.1.schema.json",
    "schema_sha256": "aaa06ec2e530dd4ae8e3d769c7cc6263702290466d2c695f9ce9da14e2069f42",
    "sha256": "885e5366fc1d7a8e99c10f0786d9ed4de386e673cdcc29cf550741d0cb159768"
  },
  "reconstruction_answers": [],
  "run_id": "rehearsal-006",
  "stage": "prediction",
  "submission_id": "submission.predict.fixture.v02",
  "submitted_at": "2026-07-28T01:14:00Z",
  "task_id": "task.predict.neutral"
}
