{
  "$schema": "https://github.com/onovich/Game-Primitives/blob/main/research/calibration-tests/continuous-action-pilot/schema/role-submission-0.1.2.schema.json",
  "actor": {
    "identifier": "actor.r006.v02.b",
    "model": "OpenAI Codex",
    "model_version": "gpt-5.6-sol",
    "reasoning_effort": "high",
    "role": "blind_reconstructor_predictor",
    "session_id": "019fa4b0-4263-73a0-8640-6e1132c70684"
  },
  "artifact_type": "prediction_submission",
  "artifact_version": "0.1.2",
  "audit_checks": [],
  "audit_decision": null,
  "condition_id": "condition-v02",
  "findings": [],
  "first_submission": true,
  "input_artifacts": [
    {
      "artifact_id": "task.predict.neutral",
      "sha256": "53f46034304fd6659550e553a4aedc5af46556818c5c2dd4d20375a7b708cc0b"
    },
    {
      "artifact_id": "envelope.rehearsal-006.stage2",
      "sha256": "a3a951fdb95cf2a6cb1c473b5ef741e8bba8cd653b121b54476a772936449f49"
    },
    {
      "artifact_id": "template.prediction.rehearsal-006",
      "sha256": "1f60b5e5d6e0da72998c45eba6e88597747cf24252b9d0b7b6094f120a32838b"
    },
    {
      "artifact_id": "submission.r006.reconstruction.v02.b",
      "sha256": "0042612361d4abf3e312e4b4f068e3370fee52b7fe2e269eff90dbeae8ff343a"
    }
  ],
  "packaging": {
    "copied_fields": [
      "pollution",
      "prediction_answers"
    ],
    "envelope_path": "research/calibration-tests/continuous-action-pilot/rehearsals/rehearsal-006/envelopes/prediction-v02-b.envelope.json",
    "envelope_sha256": "0d0ad3ec164394f8ba824c9cfaf774c01690f76c4bb14c2855df5e17889763dc",
    "mode": "deterministic_field_copy",
    "semantic_copy_verified": true,
    "tool_path": "research/calibration-tests/continuous-action-pilot/tools/build-role-submission-v0.1.1.py",
    "tool_sha256": "d43a3248a645eaeac8d495409ac5fbfe95b66a8d0c7260fa4639ed19472890e7"
  },
  "pollution": {
    "familiarity": {
      "exact_result_knowledge": "none",
      "exact_rule_knowledge": "none",
      "exact_variant_knowledge": "none",
      "project_exposure": "none",
      "recognition_status": "none",
      "recognized_family": null,
      "recognized_work": null,
      "related_genre_experience": "unknown"
    },
    "integrity_exposures": [],
    "stage_update_note": null
  },
  "prediction_answers": [
    {
      "assumptions": [],
      "case_id": "CA-R2",
      "compatible_alternatives": [
        {
          "alternative_id": "alternative.config-independent-addition",
          "description": "每次 op.accumulate 将原始输入加到 state.total，v-q 不影响状态更新；两个配置均得到 2+5。",
          "expectations": [
            {
              "configuration_id": "config.baseline",
              "expectation_kind": "exact",
              "observation_id": "obs.total-at-stop",
              "tolerance_rule_id": "tol.synthetic.exact",
              "value": {
                "serialized_value": "7",
                "unit": "count",
                "value_type": "integer"
              }
            },
            {
              "configuration_id": "config.variant",
              "expectation_kind": "exact",
              "observation_id": "obs.total-at-stop",
              "tolerance_rule_id": "tol.synthetic.exact",
              "value": {
                "serialized_value": "7",
                "unit": "count",
                "value_type": "integer"
              }
            }
          ]
        },
        {
          "alternative_id": "alternative.config-selects-sign",
          "description": "每次 op.accumulate 在 v-q=0 时加上原始输入，在 v-q=1 时减去原始输入；基线得到 7，变体得到 -7。",
          "expectations": [
            {
              "configuration_id": "config.baseline",
              "expectation_kind": "exact",
              "observation_id": "obs.total-at-stop",
              "tolerance_rule_id": "tol.synthetic.exact",
              "value": {
                "serialized_value": "7",
                "unit": "count",
                "value_type": "integer"
              }
            },
            {
              "configuration_id": "config.variant",
              "expectation_kind": "exact",
              "observation_id": "obs.total-at-stop",
              "tolerance_rule_id": "tol.synthetic.exact",
              "value": {
                "serialized_value": "-7",
                "unit": "count",
                "value_type": "integer"
              }
            }
          ]
        }
      ],
      "confidence_percent": 100,
      "expectations": [
        {
          "configuration_id": "config.baseline",
          "expectation_kind": "status",
          "observation_id": "obs.total-at-stop",
          "tolerance_rule_id": "tol.synthetic.exact",
          "value": {
            "serialized_value": "indeterminate",
            "unit": null,
            "value_type": "status"
          }
        },
        {
          "configuration_id": "config.variant",
          "expectation_kind": "status",
          "observation_id": "obs.total-at-stop",
          "tolerance_rule_id": "tol.synthetic.exact",
          "value": {
            "serialized_value": "indeterminate",
            "unit": null,
            "value_type": "status"
          }
        }
      ],
      "prediction_status": "indeterminate",
      "reasoning": "第一阶段未能恢复 v-q、原始输入与状态更新之间的关系。中性变体信封仅固定轨迹、操作和观察边界，没有规定 v-q 是否或如何改变 op.accumulate，因此存在产生不同精确结果的多个相容结构。",
      "supporting_record_ids": []
    }
  ],
  "prior_stage_submission_sha256": "0042612361d4abf3e312e4b4f068e3370fee52b7fe2e269eff90dbeae8ff343a",
  "raw_payload": {
    "artifact_id": "payload.submission.r006.prediction.v02.b",
    "path": "research/calibration-tests/continuous-action-pilot/rehearsals/rehearsal-006/raw/prediction-v02-b.payload.json",
    "schema_path": "research/calibration-tests/continuous-action-pilot/schema/blind-response-interface-0.1.1.schema.json",
    "schema_sha256": "aaa06ec2e530dd4ae8e3d769c7cc6263702290466d2c695f9ce9da14e2069f42",
    "sha256": "6cd6ea695fa685093f20f305f003efdbef299ad40f3ec3453f5cbd192a35fca4"
  },
  "reconstruction_answers": [],
  "run_id": "rehearsal-006",
  "stage": "prediction",
  "submission_id": "submission.r006.prediction.v02.b",
  "submitted_at": "2026-07-27T17:49:56Z",
  "task_id": "task.predict.neutral"
}
